{
  "apiVersion": "agency.os/v1alpha1",
  "kind": "Project",
  "metadata": {
    "projectId": "temple-companion-001",
    "name": "Temple Companion",
    "description": "Web application providing daily devotional support for Hare Krishna devotees based on original teachings of Srila Prabhupada",
    "owner": "devotee@vibe.agency",
    "createdAt": "2025-11-14T13:30:00Z",
    "lastUpdatedAt": "2025-11-14T14:00:00Z"
  },
  "spec": {
    "vibe": {
      "project_type": "nonprofit",
      "abstraction_level": "WEB_APP",
      "target_users": "Hare Krishna devotees, temple-goers, spiritual practitioners",
      "core_purpose": "Daily spiritual practice support with authentic Prabhupada teachings",
      "key_values": [
        "Authenticity (original Prabhupada teachings only)",
        "Accessibility (offline-first, mobile)",
        "Simplicity (no distractions, pure devotion)"
      ],
      "delivery_model": "Static web app, free and open-source"
    },
    "genesis": {}
  },
  "status": {
    "projectPhase": "PLANNING",
    "lastUpdate": "2025-11-14T14:00:00Z",
    "message": "Project initialized. Manifest cleaned up to high-level metadata only."
  },
  "artifacts": {
    "planning": {},
    "code": {},
    "test": {},
    "deployment": {}
  }
}
